{
  "schemaVersion": "radar-arena-run-v0.1",
  "systemName": "Contract Radar Codex Evaluator",
  "version": "contract-radar-v0.4 / codex-cli 0.135.0",
  "model": "gpt-5.4",
  "taskPromptSha256": "87d2dca2f61f9aae1ec77501c091eb2fb8b9f8de696d2f06accd83efada6c88e",
  "startedAt": "2026-07-16T12:22:15.852Z",
  "finishedAt": "2026-07-16T12:27:47.316Z",
  "totalLatencyMs": 637855,
  "totalTokens": null,
  "totalCostUsd": null,
  "failedEpisodes": 0,
  "episodeRuns": [
    {
      "episodeId": "radar-arena-v0.1-episode-01",
      "prCount": 40,
      "pairCount": 780,
      "latencyMs": 306431
    },
    {
      "episodeId": "radar-arena-v0.1-episode-02",
      "prCount": 40,
      "pairCount": 780,
      "latencyMs": 331424
    }
  ],
  "notes": "Each episode used only the supplied JSON. All 780 unordered pairs were considered; structurally isolated cross-module pairs were eliminated before same-module semantic ranking."
}
