{
  "schemaVersion": "radar-arena-run-v0.1",
  "systemName": "assumption-radar",
  "version": "0.9.0",
  "model": "deterministic-heuristics+SCIR",
  "taskPromptSha256": "87d2dca2f61f9aae1ec77501c091eb2fb8b9f8de696d2f06accd83efada6c88e",
  "startedAt": "2026-07-16T08:25:32.292Z",
  "finishedAt": "2026-07-16T08:25:40.053Z",
  "totalLatencyMs": 7759.818125,
  "totalTokens": 0,
  "totalCostUsd": 0,
  "failedEpisodes": 0,
  "episodeRuns": [
    {
      "episodeId": "radar-arena-v0.1-episode-01",
      "prCount": 40,
      "pairCount": 780,
      "latencyMs": 3971.03075
    },
    {
      "episodeId": "radar-arena-v0.1-episode-02",
      "prCount": 40,
      "pairCount": 780,
      "latencyMs": 3749.3832079999997
    }
  ],
  "notes": "Current deterministic v0.9 ranks every pair by verdict and witness strength without AI calls."
}
