{
  "schemaVersion": "radar-arena-run-v0.1",
  "systemName": "integrated",
  "version": "integrated-v0.1",
  "model": "deterministic+SCIR+patch-effects+intent-retrieval",
  "taskPromptSha256": "87d2dca2f61f9aae1ec77501c091eb2fb8b9f8de696d2f06accd83efada6c88e",
  "startedAt": "2026-07-17T02:55:47.769Z",
  "finishedAt": "2026-07-17T02:55:55.440Z",
  "totalLatencyMs": 7671.023708999999,
  "totalTokens": 0,
  "totalCostUsd": 0,
  "failedEpisodes": 0,
  "episodeRuns": [
    {
      "episodeId": "radar-arena-v0.1-episode-01",
      "prCount": 40,
      "pairCount": 780,
      "latencyMs": 3833.716167
    },
    {
      "episodeId": "radar-arena-v0.1-episode-02",
      "prCount": 40,
      "pairCount": 780,
      "latencyMs": 3806.394708
    }
  ],
  "notes": "Local deterministic run on the frozen arena."
}
